Amazon.com,2022-01-29T18:19:15Z,USD,8.35,0.5,0,0,8.85,36.33,2.18,B07V7S2BK9,New,1,Closed,Shipped,2022-02-01T21:31:02Z,next-1dc,UPS(1Z077V0E0343915732),"Pre-Moistened Lens Wipes ALIBEISS Screen Wipes for Glasses, Camera,Tablets, Smartphone, Screens and Other Delicate Surfaces,Pack of 100"
Amazon.com,2022-01-29T18:13:22Z,USD,8.35,0,0,0,0,Not Available,Not Available,B07V7S2BK9,New,0,Cancelled,Not Available,Not Available,second-nominated-day,Not Available,"Pre-Moistened Lens Wipes ALIBEISS Screen Wipes for Glasses, Camera,Tablets, Smartphone, Screens and Other Delicate Surfaces,Pack of 100"
Amazon.com,2022-01-29T18:13:22Z,USD,19.49,0,0,0,0,Not Available,Not Available,B002ZG8WR0,New,0,Cancelled,Not Available,Not Available,second-nominated-day,Not Available,Kiwi Suede and Nubuck Kit
Amazon.com,2022-01-29T18:13:22Z,USD,13.99,0,0,0,0,Not Available,Not Available,B08DTCLB6G,New,0,Cancelled,Not Available,Not Available,second-nominated-day,Not Available,"USB C to USB C Cable 100W 10ft, JSAUX PD USB Type C Super Fast Charger Cable Compatible with MacBook Pro, Air 2020/2019 (M1), iPad Pro/Air 4, iPad Mini 6, Galaxy S21/S20/S10/A52, Pixel 6, Switch-Green"
Amazon.com,2022-01-29T18:13:22Z,USD,9.99,0,0,0,0,Not Available,Not Available,B08PCJYS6Z,New,0,Cancelled,Not Available,Not Available,second-nominated-day,Not Available,Spigen NeoFlex Screen Protector Designed for Samsung Galaxy S21 Ultra (2021) [2 Pack] - Case Friendly
Amazon.com,2022-01-29T02:51:33Z,USD,17.99,0,0,0,17.99,17.99,0,B08D6XM6B6,New,1,Closed,Shipped,2022-01-30T05:50:01Z,next-1dc,AMZN_US(TBA173780042904),"Anirollz x Nissin Cupnoodle Pandaroll 6"" Blanket Plush Soft Squishy Stuffed Animal Panda"
Amazon.com,2022-01-27T02:59:08Z,USD,15.89,0.95,0,0,16.84,15.89,0.95,B09CM7M5KC,New,1,Closed,Shipped,2022-01-28T04:13:28Z,second-nominated-day,AMZN_US(TBA171572648304),"Alldriey 3D Washable Reusable Kids Face Mask Masks, Cute Adjustable Children Facemask Boys Girls Kid, Childrens Cartoon Breathable Cloth Facemasks, Sm"
Amazon.com,2022-01-27T02:59:08Z,USD,12.99,0.78,0,0,13.77,12.99,0.78,B09FDC3J8W,New,1,Closed,Shipped,2022-01-27T16:18:39Z,next-1dc,AMZN_US(TBA171379785804),Uimmit Cute White Black Cartoon Rabbit Face Mask Decoration Reusable Washable Breathable Adjustable Mouth Covers for Kids Boys Girls
Amazon.com,2022-01-25T15:31:04Z,USD,29.99,1.8,0,0,31.79,29.99,1.8,B003C54M9A,New,1,Closed,Shipped,2022-01-26T20:29:28Z,std-n-us,AMZN_US(TBA170347558204),"16 fl oz - Peppermint Essential Oil 100% Pure, Uncut - GreenHealth"
Amazon.com,2022-01-25T15:29:19Z,USD,9.79,0.59,0,0,10.38,9.79,0.59,B06XJ59SVW,New,1,Closed,Shipped,2022-01-25T18:50:35Z,next-1dc,AMZN_US(TBA169143794204),LibiIine 100pcs Mix Lots Flatback Resin Buttons Flat back Scrapbooking Resin Flatback Craft
Amazon.com,2022-01-25T15:29:19Z,USD,17.89,1.07,0,0,18.96,35.78,2.14,B09FZ7H3Y6,New,1,Closed,Shipped,2022-01-26T04:56:48Z,next-1dc,AMZN_US(TBA169514439804),"Kids Washable Face Mask With Adjustable Ear Loops, Cute Designer Mask for Kid (pattern)"
Amazon.com,2022-01-25T15:29:19Z,USD,17.89,1.07,0,0,18.96,35.78,2.14,B09H2CLTR3,New,1,Closed,Shipped,2022-01-26T04:56:48Z,next-1dc,AMZN_US(TBA169514439804),"Kids Washable Face Masks With Adjustable Ear Loops, 4D Cute Designer Mask for Kid (unicorn pineapple)"
Amazon.com,2022-01-25T15:29:19Z,USD,10.99,0.66,0,0,23.3,21.98,1.32,B08HLYRRXJ,New,2,Closed,Shipped,2022-01-26T00:22:12Z,next-1dc,AMZN_US(TBA169475739004),"5 PCS Adjustable Length Kids M.ask Lanyards with Rubber Clips , Safety & Comfortable M.ask Holder Lanyard ,Release Ear Pressure M.ask Strap Kid Around The Neck (5 Multi-Color-Animals)"
Amazon.com,2022-01-18T03:19:29Z,USD,5.55,0.33,0,0,5.88,5.55,0.33,B00MEV12AU,New,1,Closed,Shipped,2022-01-18T18:19:07Z,Econ US Dom,USPS(0004089775753445425923604130103),Tactical State Patch - Georgia - Multitan
Amazon.com,2022-01-18T03:19:29Z,USD,8.35,0.5,0,0,8.85,29.32,1.76,B07S72NRQQ,New,1,Closed,Shipped,2022-01-20T08:03:39Z,next-1dc,USPS(9374889703008881095050),3 Pack Animal Bear Tiger Fox Tactical Morale Patches Embroidered Military Emblem Badge Hook and Loop Patch for Backpack Rucksack Baseball Cap Jackets
Amazon.com,2022-01-18T03:19:29Z,USD,10.99,0.66,0,0,11.65,29.32,1.76,B0931QH5PX,New,1,Closed,Shipped,2022-01-20T08:03:39Z,next-1dc,USPS(9374889703008881095050),"Eybros American Flag Patch, 10 Bundle-Set, Tactical Morale Military Patches of USA US for Backpacks Hat Army Gears Etc"
Amazon.com,2022-01-18T03:19:29Z,USD,9.98,0.6,0,0,10.58,29.32,1.76,B08L447MDV,New,1,Closed,Shipped,2022-01-20T08:03:39Z,next-1dc,USPS(9374889703008881095050),"CRAFTSMAN Tool Tray, Collapsible, Magnetic, 2-Piece (CMMT98343)"
Amazon.com,2022-01-18T03:19:29Z,USD,6.79,0.41,0,0,7.2,29.78,1.79,B076S6KMY9,New,1,Closed,Shipped,2022-01-19T20:25:34Z,next-1dc,UPS(1Z39R1A90332112260),"OGX Extra Strength Refreshing Scalp + Teatree Mint Shampoo, Invigorating Scalp Shampoo with Tea Tree & Peppermint Oil & Witch Hazel, Paraben-Free, Sul"
Amazon.com,2022-01-18T03:19:29Z,USD,22.99,1.38,0,0,24.37,29.78,1.79,B09DPMTHSR,New,1,Closed,Shipped,2022-01-19T20:25:34Z,next-1dc,UPS(1Z39R1A90332112260),"LED Desk Lamp, LASTAR Dimmable Eye-Protecting Table Lamps with Night Light, USB Charging Port, 4 Color Temperature Modes, 5 Brightness Levels, 1H Timer, Touch Control for Home Office Bedroom"
Amazon.com,2022-01-11T07:01:35Z,USD,11.74,0.61,0,'-1.51',10.84,17.25,0.94,B000YJ2SLG,New,1,Closed,Shipped,2022-01-12T22:05:06Z,next-1dc,UPS(1Z804TT30371187260),CeraVe Daily Moisturizing Lotion for Dry Skin | Body Lotion & Facial Moisturizer with Hyaluronic Acid and Ceramides | 12 Fl Ounce
Amazon.com,2022-01-11T07:01:35Z,USD,5.51,0.33,0,0,5.84,17.25,0.94,B003K01BMI,New,1,Closed,Shipped,2022-01-12T22:05:06Z,next-1dc,UPS(1Z804TT30371187260),"DenTek Triple Clean Advanced Clean Floss Picks, No Break & No Shred Floss, 150 Count"
Amazon.com,2022-01-11T06:59:53Z,USD,12.39,0,0,0,0,Not Available,Not Available,B00365DABC,New,0,Cancelled,Not Available,Not Available,next-1dc,Not Available,"CeraVe PM Facial Moisturizing Lotion | Night Cream with Hyaluronic Acid and Niacinamide | Ultra-Lightweight, Oil-Free Moisturizer for Face | 3 Ounce"
Amazon.com,2022-01-11T06:59:53Z,USD,5.51,0,0,0,0,Not Available,Not Available,B003K01BMI,New,0,Cancelled,Not Available,Not Available,next-1dc,Not Available,"DenTek Triple Clean Advanced Clean Floss Picks, No Break & No Shred Floss, 150 Count"
Amazon.com,2022-01-09T20:15:09Z,USD,16.99,1.02,0,0,18.01,16.99,1.02,1539894177,New,1,Closed,Shipped,2022-01-11T19:38:58Z,next-1dc,UPS(1Z804E330364088398),The Last Marine (Volume 1)
Amazon.com,2022-01-09T15:09:36Z,USD,18.79,1.13,0,0,19.92,18.79,1.13,B00DNYXJP8,New,1,Closed,Shipped,2022-01-10T18:29:40Z,second,UPS(1ZY493170306602368),"Charmin Ultra Gentle Toilet Paper, 18 Mega rolls = 72 regular rolls"
Amazon.com,2022-01-03T17:12:30Z,USD,6.99,0.56,0,0,7.55,6.99,0.56,B07PPP5C41,New,1,Closed,Shipped,2022-01-04T20:41:17Z,std-us-nft,UPS(1Z9135VY0357687570),"TEPE Good Tongue Scraper Cleaner, Bioplastic Tongue Cleaner for Adults and Kids, Plastic Scraper, 1 Pk"
Amazon.com,2022-01-03T05:06:21Z,USD,2.86,0.16,0,'-0.14',2.88,2.86,0.16,B005JRB9TU,New,1,Closed,Shipped,2022-01-17T14:20:04Z,std-sns-us,AMZN_US(TBA158573607104),"Opti-Free Puremoist Multi-Purpose Disinfecting Solution with Lens Case, (Packaging may vary), 2 Fl Oz (Pack of 1)"
Amazon.com,2022-01-01T14:28:55Z,USD,8.65,0,0,0,8.65,8.65,0,B01D4FEP8U,New,1,Closed,Shipped,2022-01-04T15:34:14Z,next-1dc,UPS(1Z0927WX0336145310),Eagle Brand Medicated Oil External Analgesic (Aromatic-Lavender Eucalyptus) 24ml
Amazon.com,2021-12-24T17:47:10Z,USD,27.59,1.66,0,0,29.25,27.59,1.66,B079WVVN9Y,New,1,Closed,Shipped,2021-12-27T06:31:10Z,next-1dc,AMZN_US(TBA131318148804),"Waterdrop DA97-17376B Replacement for Samsung HAF-QIN/EXP, DA97-08006C, RF28R7201SR, RF28R7351SG, WD-F45, Refrigerator Water Filter, 3 Filters"
Amazon.com,2021-12-18T11:12:46Z,USD,13.99,0.84,0,0,14.83,13.99,0.84,B09FG5KMHP,New,1,Closed,Shipped,2021-12-21T17:43:17Z,second,SUREPOST(1ZX373F9YN03785145),Supwee Universal Rainbow Cat Eye Gel Polish Holographic 9D Cat Eye Nail Polish Sparkle Nail Gel Polish with Magnetic Stick Varnish Nail Art Nail Salon Manicure 1 Bottle 10ML(0.33fl.oz)
Amazon.com,2021-12-18T11:12:46Z,USD,22.99,1.38,0,0,24.37,22.99,1.38,B093RY1CMZ,New,1,Closed,Shipped,2021-12-18T14:43:16Z,second,AMZN_US(TBA119655467304),"BORN PRETTY Magnetic Gel Polish Set,Reflective Glitter Auroras Snowlight Cat Magnetic Polish LED Gel Nail Art Manicure Kit Holiday Gift Sets 6Pcs 7ML"
Amazon.com,2021-12-18T11:12:46Z,USD,20.99,1.26,0,0,22.25,20.99,1.26,B08NSRN6TX,New,1,Closed,Shipped,2021-12-20T08:32:08Z,second,AMZN_US(TBA121328603604),"BURANO Reflective Glitter Gel Polish, 6 Colors Reflective Glitter Sparkling Holographic Gel Nail Polish, Soak Off LED UV Gel Nail Kit with Cuticle Oil Gift UV Lamp Required (Sparkle Glitter)"
Amazon.com,2021-12-17T19:49:35Z,USD,55.81,3.35,0,0,59.16,55.81,3.35,B08NCNBBTW,New,1,Closed,Shipped,2021-12-17T20:49:11Z,rush,AMZN_US(TBA445892720000),OTTERBOX DEFENDER SERIES SCREENLESS EDITION Case for Galaxy S21 Ultra 5G (ONLY - DOES NOT FIT non-Plus or Plus sizes) - BLACK
Amazon.com,2021-12-16T17:12:57Z,USD,34.95,1.4,0,0,36.35,34.95,1.4,B08P21F15P,New,1,Closed,Shipped,2021-12-17T20:14:33Z,std-n-us,UPS(1Z81WV111383689407),"Womens Cashmere Gloves, Made In Scotland, 100% Cashmere (Green)"
Amazon.com,2021-12-14T15:27:44Z,USD,10.99,0.88,0,0,11.87,10.99,0.88,B00DVPS4IQ,New,1,Closed,Shipped,2021-12-17T20:14:38Z,next-1dc,UPS(1Z81WV111383689407),15 Pack Easy@Home Marijuana (THC) Single Panel Drug Tests Kit - #EDTH-114
Amazon.com,2021-12-09T06:00:39Z,USD,14.99,0.9,0,0,15.89,14.99,0.9,1671942507,New,1,Closed,Shipped,2021-12-13T06:58:21Z,next-1dc,UPS(1Z39R5251303468654),Undaunted Valor: Medal of Honor
Amazon.com,2021-12-06T05:07:34Z,USD,24.4,1.46,0,0,25.86,24.4,1.46,B07HNL8JQP,New,1,Closed,Shipped,2021-12-06T18:32:55Z,next-1dc,AMZN_US(TBA097784076804),HUDA BEAUTY Topaz Obsessions Palette Limited Edition
Amazon.com,2021-12-05T21:10:32Z,USD,10.39,0.62,0,0,11.01,77.72,4.66,B08Y6GH74Q,New,1,Closed,Shipped,2021-12-08T15:46:23Z,next-1dc,UPS(1Z39R1A90331275328),"Workout Sports Face Mask Breathable,Running Cotton Fabric Gym Design for Glasses Wearers Lady Men Black Normal Large Size N"
Amazon.com,2021-12-05T21:10:32Z,USD,11.98,0.72,0,0,12.7,77.72,4.66,B003NS0EWK,New,1,Closed,Shipped,2021-12-08T15:46:23Z,next-1dc,UPS(1Z39R1A90331275328),Amodex Ink and Stain Remover Unique Soap Formula 4 fl oz Bottle
Amazon.com,2021-12-05T21:10:32Z,USD,32.39,1.94,0,0,34.33,77.72,4.66,B0915K8DZ1,New,1,Closed,Shipped,2021-12-08T15:46:23Z,next-1dc,UPS(1Z39R1A90331275328),"Stroller Fan Rechargeable, 10000mAh Portable Clip on Fan, 8 Inch Persoanl Cooling Fan(Up to 24H of Use), Battery Operated Desk Fan, 4-Speed Fast Outdoor Fan, USB Fan for Bedroom, Office, Camping"
Amazon.com,2021-12-05T21:10:32Z,USD,22.96,1.38,0,0,24.34,77.72,4.66,B08ZGK1FFJ,New,1,Closed,Shipped,2021-12-08T15:46:23Z,next-1dc,UPS(1Z39R1A90331275328),"Gain Flings 3-in-1 Liquid Laundry Detergent Pacs, Moonlight Breeze Scent, 3 Bag Value Pack, 111 Count, HE Compatible"
Amazon.com,2021-12-05T02:00:52Z,USD,119.99,6.6,0,'-10',116.59,119.99,6.6,B09B6N2JB5,New,1,Closed,Shipped,2021-12-05T10:49:32Z,next-1dc,AMZN_US(TBA095911452904),LUCHEN Steam Sauna Tent 1000W Indoor Home Sauna with Remote Control Folding Chair and 2L Steam Pot for Detox Reduce Stress Fatigue
Amazon.com,2021-12-02T16:58:14Z,USD,10.39,0.62,0,0,11.01,24.34,1.46,B09DG4TXBJ,New,1,Closed,Shipped,2021-12-06T16:49:58Z,next-1dc,UPS(1Z82RV541350151533),"Wired Earbuds with Microphone, Kimwood Earphones in-Ear Headphones HiFi Stereo, Powerful Bass and Crystal Clear Audio, 3.5mm Headphone for iPhone, iPad, Android Phones, MP3, Laptop, Computer (Black)"
Amazon.com,2021-12-02T16:58:14Z,USD,13.95,0.84,0,0,14.79,24.34,1.46,B07NW89B61,New,1,Closed,Shipped,2021-12-06T16:49:58Z,next-1dc,UPS(1Z82RV541350151533),"Sero Innovation Boat Cover Snap Extender - Black - Extension Size, 1"" - Built in Finger Loops. Extend The Life of Your Boat top Canvas! 5 Pack"
Amazon.com,2021-12-01T14:50:51Z,USD,74.99,4.5,0,0,79.49,74.99,4.5,B07YZ6RKZH,New,1,Closed,Shipped,2021-12-03T03:42:49Z,next-1dc,AMZN_US(TBA091714617704),"Bietrun Wireless Microphone with Adjustable Echo/Treble/Bass with Bluetooth, 160 ft Range, Metal Dual Dynamic Handheld Mic System, 1/8''&#xFF06;1/4''O"
Amazon.com,2021-12-01T14:50:51Z,USD,9.99,0,0,0,9.99,19.98,0,B07QF4C8T5,New,1,Closed,Shipped,2021-12-01T20:09:23Z,Std US D2D Dom,Email(93808cc2fa20403492c0e85086689983) and Email(c3c7e00325654b7aa1e19c6c8572a308),ASURION 4 Year Music Accident Protection Plan $70-79.99
Amazon.com,2021-12-01T14:50:51Z,USD,9.99,0,0,0,9.99,19.98,0,B07QC4X6PY,New,1,Closed,Shipped,2021-12-01T20:09:23Z,Std US D2D Dom,Email(93808cc2fa20403492c0e85086689983) and Email(c3c7e00325654b7aa1e19c6c8572a308),ASURION 4 Year Music Accident Protection Plan $50-59.99
Amazon.com,2021-12-01T14:50:51Z,USD,59.99,3.31,0,'-4.8',58.5,59.99,3.31,B089F37NGY,New,1,Closed,Shipped,2021-12-02T22:59:26Z,next-1dc,AMZN_US(TBA091701381204),"Bietrun Wireless Microphone with Echo, Treble, Bass & Bluetooth, 98 FT Range, Portable UHF Handheld Karaoke Dynamic Microphone System with Rechargeabl"
Amazon.com,2021-12-01T01:42:21Z,USD,109.97,6.6,0,0,116.57,109.97,6.6,B07Z67ZVLK,New,1,Closed,Shipped,2021-12-01T23:10:59Z,second,AMZN_US(TBA089607855304),"Kithouse S9 UHF Rechargeable Wireless Microphone System Karaoke Microphone Wireless Mic Cordless Dual with Bluetooth Receiver Box + Volume Control ECHO for Karaoke Singing Speech Meeting Church, 200FT"
Amazon.com,2021-11-30T22:38:38Z,USD,200,0,0,0,200,200,0,B09LXP4VHY,New,1,Closed,Shipped,2021-11-30T22:43:36Z,Not Available,Not Available,Amazon eGift Card - Unboxing Merry Christmas (Animated)
Amazon.com,2021-11-30T06:10:43Z,USD,48.99,2.94,0,0,51.93,48.99,2.94,B0148W0WOE,New,1,Closed,Shipped,2021-11-30T13:37:20Z,Econ US Dom,USPS(9300120111408769626538),"Syngenta 383920 Advion Cockroach Gel Bait 4 X 30 Gram Tubes Roach Control, 4 30, Brown"
Amazon.com,2021-11-30T06:10:43Z,USD,15.99,0.96,0,0,16.95,15.99,0.96,B08HWHD58L,New,1,Closed,Shipped,2021-11-30T19:57:01Z,next-1dc,AMZN_US(TBA087371330504),"advion 68663 Arena 12ct Bag Cockroach Bait Station, White"
Amazon.com,2021-11-30T01:41:04Z,USD,109.99,5.4,0,'-20',95.39,109.99,5.4,B07RJLKBRD,New,1,Closed,Shipped,2021-11-30T06:35:18Z,next-1dc,AMZN_US(TBA086448960804),"TONOR Wireless Microphone,Metal Dual Professional UHF Cordless Dynamic Mic Handheld Microphone System for Home Karaoke, Meeting, Party, Church, DJ, Wedding, Home KTV Set, 200ft(TW-820)"
Amazon.com,2021-11-30T01:41:04Z,USD,29.99,0,0,0,29.99,29.99,0,B07P97QMC4,New,1,Closed,Shipped,2021-11-30T13:23:40Z,Std US D2D Dom,Email(ac9df4bdce9f4617a66d77faa03a7085),ASURION 4 Year Music Accident Protection Plan $100-124.99
Amazon.com,2021-11-28T03:04:15Z,USD,17.99,1.08,0,0,19.07,17.99,1.08,B00RX91OJW,New,1,Closed,Shipped,2021-11-29T20:05:52Z,next-1dc,UPS(1Z077A2R0293368307),Enchanteur MoistureSilk Perfumed Body Lotion Charming
Amazon.com,2021-11-28T03:01:47Z,USD,23.29,1.4,0,0,49.38,46.58,2.8,B079K491T9,New,2,Closed,Shipped,2021-11-29T21:06:39Z,next-1dc,AMZN_US(TBA170503553201),Enchanteur Perfumed Shower Gel Charming 550ml
Amazon.com,2021-11-26T03:39:11Z,USD,44.99,0,0,0,44.99,44.99,0,B07P83RMWL,New,1,Closed,Shipped,2021-11-26T08:52:57Z,Std US D2D Dom,Email(526137f2a3b244a8b9e8b156a8f8a099),ASURION 4 Year Music Accident Protection Plan $300-349.99
Amazon.com,2021-11-26T03:39:11Z,USD,329,19.74,0,0,348.74,329,19.74,B001B1XK86,New,1,Closed,Shipped,2021-11-26T21:17:04Z,next-1dc,UPS(1ZX1F5480308344214),"VocoPro UHF-3205 UHF-Dual Channel Rechargeable Wireless Microphone System, 21.00 x 21.00 x 23.00"
Amazon.com,2021-11-25T00:06:41Z,USD,13.99,0.84,0,0,14.83,13.99,0.84,B00535V9Z2,New,1,Closed,Shipped,2021-11-26T17:45:29Z,Std US D2D Dom,USPS(9400111699000853430238),G.I. Entrenching Tool Cover- New Old Stock
Amazon.com,2021-11-25T00:06:41Z,USD,13.99,0.84,0,0,14.83,13.99,0.84,1703382641,New,1,Closed,Shipped,2021-11-26T22:28:33Z,next-1dc,UPS(1Z81E2230314747005),Undaunted Valor: An Assault Helicopter Unit in Vietnam
Amazon.com,2021-11-25T00:06:41Z,USD,12.99,0.74,0,'-0.65',13.08,12.99,0.74,B07Z82895W,New,1,Closed,Shipped,2021-11-26T15:50:59Z,next-1dc,UPS(1Z6433W10339308003),"LISEN Cell Phone Stand, Angle Height Adjustable Phone Stand for Desk, Thick Case Friendly Phone Holder Stand, Taller iPhone Stand Compatible with All Mobile Phones,iPhone,Switch,iPad,Tablet(4-10in)"
Amazon.com,2021-11-20T15:08:37Z,USD,19.95,1.6,0,0,21.55,19.95,1.6,B07DCYQCPX,New,1,Closed,Shipped,2021-11-23T18:19:55Z,next-1dc,UPS(1Z805F200337431365),"Ruled Notebook - British A5 Journal by Beechmore Books | Large 5.75"" x 8.25"" Hardcover Vegan Leather, Thick 120gsm Cream Lined Paper | Gift Box | Ches"
Amazon.com,2021-11-20T11:53:28Z,USD,17.99,1.08,0,0,19.07,28.98,1.74,B011HMDZ0Q,New,1,Closed,Shipped,2021-11-20T21:21:04Z,next-1dc,USPS(9361289703007294387640),Redragon M602 RGB Wired Gaming Mouse RGB Spectrum Backlit Ergonomic Mouse Griffin Programmable with 7 Backlight Modes up to 7200 DPI for Windows PC Ga
Amazon.com,2021-11-20T11:53:28Z,USD,10.99,0.66,0,0,11.65,28.98,1.74,B075DFPR2W,New,1,Closed,Shipped,2021-11-20T21:21:04Z,next-1dc,USPS(9361289703007294387640),"Puroma 2 Pack Combination Lock 4 Digit Outdoor Waterproof Padlock for School Gym Locker, Sports Locker, Fence, Toolbox, Gate, Case, Hasp Storage (Black)"
Amazon.com,2021-11-17T01:16:03Z,USD,15.99,0.96,0,0,16.95,15.99,0.96,B01EMXWPIK,New,1,Closed,Shipped,2021-11-17T21:56:55Z,second-nominated-day,UPS(1Z445FW80391381066),"Saicoo DOD Military USB Common Access CAC Smart Card Reader, Compatible with Mac Os, Win (Vertical Version)"
Amazon.com,2021-11-17T01:16:03Z,USD,2.83,0.17,0,0,3,2.83,0.17,B00006HTZ0,New,1,Closed,Shipped,2021-11-17T22:39:39Z,second,UPS(1Z82V6150269759455),Belkin Standard 8-Inch by 9-Inch Computer Mouse Pad with Neoprene Backing and Jersey Surface (Black) (F8E089-BLK)
Amazon.com,2021-11-11T21:48:34Z,USD,69.95,3.85,0,'-15',58.8,69.95,3.85,B07HJPBV52,New,1,Closed,Shipped,2021-11-13T03:34:09Z,next-1dc,USPS(9361289673007100134956),"Kick Scooters for Kids Ages 3-5 (Suitable for 2-12 Year Old) Adjustable Height Foldable Scooter Removable Seat, 3 LED Light Wheels, Rear Brake, Wide S"
Amazon.com,2021-11-09T00:03:45Z,USD,15.99,0.96,0,0,16.95,15.99,0.96,B08K4K273P,New,1,Closed,Shipped,2021-11-09T13:33:02Z,next-1dc,AMZN_US(TBA169246921401),"10 Colors Luminous Spider Gel, UV Gel Nail Polish with 2 Nail Art Line Pen Tools DIY Glow in The Dark Nail Art Drawing Gel for Line Neon Fluorescent E"
Amazon.com,2021-11-09T00:03:45Z,USD,7.99,0.48,0,0,8.47,7.99,0.48,B097MVD3W2,New,1,Closed,Shipped,2021-11-09T07:13:22Z,next-1dc,AMZN_US(TBA169225360701),"Nail Art Holographic Glitter Fall Maple Leaf Shaped Flakes 2 Pot,Red Yellow Orange Glitter Sequins 3D Mixed Metallic Maple Glitter Nail Art Design Spangles for Acrylic Nail Kit Manicure Decorations"
Amazon.com,2021-11-06T07:24:10Z,USD,19.99,1.2,0,0,21.19,19.99,1.2,B08PKWZRPM,New,1,Closed,Shipped,2021-11-08T06:26:56Z,next-1dc,AMZN_US(TBA169160123801),TARION 8 inch Selfie Ring Light with Phone Holder Clamp On Ring Light for Desk Tabletop Ring Light 10-Level Brightness Flexible Gooseneck Stand for Li
Amazon.com,2021-11-05T00:58:24Z,USD,11.87,0.83,0,0,12.7,11.87,0.83,B0832FLTZ2,New,1,Closed,Shipped,2021-11-06T08:03:50Z,next-1dc,USPS(9361289673006964288140),YUFER Magnetic Screen Door 32×80 Reinforced Fiberglass Screen Door Magnets Screen for Doorway Sliding Door mesh with Full Frame Hook&Loop - Grey
Amazon.com,2021-11-03T11:34:15Z,USD,2.86,0.16,0,'-0.14',2.88,2.86,0.16,B005JRB9TU,New,1,Closed,Shipped,2021-11-16T05:26:28Z,std-sns-us,USPS(9374889714207129538267),"Opti-Free Puremoist Multi-Purpose Disinfecting Solution with Lens Case, (Packaging may vary), 2 Fl Oz (Pack of 1)"
Amazon.com,2021-11-03T01:11:29Z,USD,13.13,1.05,0,0,14.18,13.13,1.05,B00DOMYL24,New,1,Closed,Shipped,2021-11-05T16:00:47Z,next-1dc,UPS(1Z09833V0356924821),"GE 6-Outlet Surge Protector, 10 Ft Extension Cord, Power Strip, 800 Joules, Flat Plug, Twist-to-Close Safety Covers, UL Listed, White, 14092"
Amazon.com,2021-11-02T01:21:30Z,USD,14.99,1.2,0,0,16.19,14.99,1.2,B0819WJRVF,New,1,Closed,Shipped,2021-11-03T16:07:04Z,Std US D2D Dom,USPS(9400111202460865803747),Navpeak Mini Candle Lighter Handy Refillable for Kitchen Fireplace Pilot Light BBQ Grill Stove 5 Pack (Butane Included)
Amazon.com,2021-11-02T01:19:11Z,USD,16.99,0,0,0,0,Not Available,Not Available,B08J3Y5JR1,New,0,Cancelled,Not Available,Not Available,Std US D2D Dom,Not Available,"BIC EZ Reach Lighter, Assorted Colors, 6-Pack (Colors Will Vary), Great for Candle Lighting"
Amazon.com,2021-10-23T02:41:13Z,USD,19.95,1.2,0,0,21.15,19.95,1.2,B097ZVBHLN,New,1,Closed,Shipped,2021-10-24T03:17:42Z,next-1dc,AMZN_US(TBA038044584104),VOSOE Superhero Capes with Masks Cosplay Costumes Birthday Party Christmas Halloween Dress up Gift for Kids (Pj 3set with slap bracelet)
Amazon.com,2021-10-19T15:04:48Z,USD,8.99,0.72,0,0,9.71,8.99,0.72,B01ALBS900,New,1,Closed,Shipped,2021-10-23T19:25:18Z,next-1dc,UPS(1Z0640RX1360929288),"Arvok 13-14 Inch Laptop Sleeve Multi-color & Size Choices Case/Water-resistant Neoprene Notebook Computer Pocket Tablet Carrying Bag Cover, Black"
Amazon.com,2021-10-15T02:19:10Z,USD,29.99,1.8,0,0,31.79,29.99,1.8,B09BVPJ7P1,New,1,Closed,Shipped,2021-10-15T14:46:08Z,next-1dc,AMZN_US(TBA027920829504),Mildiso Cruella Deville Wig Costume Women with Mask Black White Wigs for Cruella Cosplay Short Half Black White Hair Wig with Bangs for Party Halloween M073BW
Amazon.com,2021-10-15T02:19:10Z,USD,44.99,2.7,0,0,47.69,44.99,2.7,B09G1CVG3P,New,1,Closed,Shipped,2021-10-15T09:56:41Z,next-1dc,AMZN_US(TBA027605105604),"Cruella Deville Costume Dress,Womens Cruella Dalmatian Cosplay Hooded Dresses Coat Halloween Skirt With Gloves M"
Amazon.com,2021-10-15T02:19:10Z,USD,49.99,3,8.47,0,61.46,49.99,3,B09FJVJFW4,New,1,Closed,Shipped,2021-10-18T07:17:14Z,Std US D2D Dom,Yun Express(YT2129221292012859),Womens Cruella Deville Costume Dress Cruella Jacket Coat with Gloves 2021 Halloween Cosplay Full Set Outfits M
Amazon.com,2021-10-12T18:51:59Z,USD,17.99,1.08,0,0,19.07,17.99,1.08,B09FDVLYW6,New,1,Closed,Shipped,2021-10-14T16:30:17Z,second,AMZN_US(TBA026741099404),Jasilon [Anti-Yellowing] Magnetic Clear Case for iPhone 13 Pro Max Case 6.7 [Compatible with MagSafe Charger&Battery] [Military-Drop Protection] [Shock-Absorbing Corners] Protective Case Bumper Cover
Amazon.com,2021-10-12T18:51:59Z,USD,39.95,2.4,0,0,42.35,39.95,2.4,B07VP2PXQB,New,1,Closed,Shipped,2021-10-13T05:25:46Z,next-1dc,AMZN_US(TBA024784733404),"Cuteshower Women Little Red Riding Hood Costume Halloween Hood Cape Party Dress (Medium, Red)"
Amazon.com,2021-10-10T21:04:31Z,USD,6.89,0.41,0,0,7.3,6.89,0.41,B09CTB3M1T,New,1,Closed,Shipped,2021-10-11T06:14:48Z,next-1dc,AMZN_US(TBA167314626001),"Ailun Glass Screen Protector Compatible for iPhone 13 Pro Max [6.7 Inch Display] 2021, 3 Pack Case Friendly Tempered Glass"
Amazon.com,2021-10-10T21:04:31Z,USD,12.99,0.78,0,0,13.77,22.98,1.38,B09DF32T4V,New,1,Closed,Shipped,2021-10-11T22:41:55Z,next-1dc,AMZN_US(TBA167381595601),"RESTONE Case for iPhone 13 Pro MAX, Clear Slim Fit Hard Back Cover Soft Silicone TPU Edge, Thin Cute Full Body Shock-Proof Anti-Yellow Transparent Protective Case for i-Phone 13 Pro MAX 6.7 Inch 2021"
Amazon.com,2021-10-10T21:04:31Z,USD,9.99,0.6,0,0,10.59,22.98,1.38,B09HTJ1LB4,New,1,Closed,Shipped,2021-10-11T22:41:55Z,next-1dc,AMZN_US(TBA167381595601),[2+2 Pack] UniqueMe Compatible with iPhone 13 Pro Max 6.7 inch Tempered Glass Screen Protector and Camera Lens Protector [Easy Installation Frame] HD Clear [Anti-Scratch][No Bubble]
Amazon.com,2021-10-10T20:37:21Z,USD,29.99,1.8,1.06,0,32.85,29.99,1.8,B09H5T12FT,New,1,Closed,Shipped,2021-10-11T01:42:49Z,Std US D2D Dom,USPS(4209265692612927005485000018704064),"Glitter Painted Gel Nail Polish Set, 12 Glitter Colors Line Nail Polish Gel Painting Drawing UV Light LED Soak Off Nail Art Design & Nail Salon DIY Ma"
Amazon.com,2021-10-10T20:37:21Z,USD,42.99,2.58,0,0,45.57,85.98,5.16,B09CD5D4BZ,New,1,Closed,Shipped,2021-10-12T10:28:44Z,next-1dc,USPS(9361289675006449045495),"24 Pcs Painted Gel Nail Polish Set, 24 Colors Line Nail Polish Gel Painting Drawing UV Light LED Soak Off Nail Art Design & Nail Salon DIY Manicure Kit (24 Neon Colors)"
Amazon.com,2021-10-10T20:37:21Z,USD,42.99,2.58,0,0,45.57,85.98,5.16,B09C73X2LB,New,1,Closed,Shipped,2021-10-12T10:28:44Z,next-1dc,USPS(9361289675006449045495),"Painted Gel Nail Polish Set, 24 Colors Line Nail Polish Gel Painting Drawing UV Light LED Soak Off Nail Art Design & Nail Salon DIY Manicure Kit (24 C"
Amazon.com,2021-10-06T03:41:49Z,USD,12.99,0.78,0,0,13.77,12.99,0.78,B089218BZX,New,1,Closed,Shipped,2021-10-07T08:10:20Z,next-1dc,AMZN_US(TBA167158361801),"Foot Peel Mask, (5 PACK) Exfoliating Foot Masks, Natural Exfoliator for Dry Dead Skin, Callus, Repair Rough Heels for Men Women"
Amazon.com,2021-10-05T17:14:28Z,USD,10.95,0.66,0,0,11.61,10.95,0.66,B088TS69J5,New,1,Closed,Shipped,2021-10-06T14:07:03Z,next-1dc,AMZN_US(TBA017041621204),"Jump Rope, H HANDIO Speed Digital Skipping Rope with Calorie Counter, Length Adjustable Jumping Rope with Alarm Reminder for Indoor and Outdoor Fitness, CrossFit, Exercise, Workout, Boxing, MMA, Gym"
Amazon.com,2021-10-05T13:29:13Z,USD,32.99,1.98,0,0,34.97,32.99,1.98,B07BHWSNB3,New,1,Closed,Shipped,2021-10-06T02:50:34Z,next-1dc,AMZN_US(TBA167069174101),&#x62D4;&#x7F50; Medical Grade Glass Cupping Therapy Set Professional Vacuum Cupping Therapy Equipment (12 pcs Thick Glass Cupping Set with BOUNS Kits
Amazon.com,2021-10-05T00:57:09Z,USD,95.99,7.68,0,0,103.67,122.23,9.78,B07FPCLPDR,New,1,Closed,Shipped,2021-10-08T16:00:52Z,next-1dc,UPS(1Z8Y91300349261870),Fujifilm Instax Mini 70 - ICY Mint Instax Mini 70 - Instant Film Camera (ICY Mint)
