Amazon.com,2021-01-01T15:49:51Z,USD,12.99,0.78,0,0,13.77,12.99,0.78,B08PJQDV4K,New,1,Closed,Shipped,2021-01-02T11:48:52Z,next-1dc,USPS(9361289675091105618298),"FALUCKYY 3000 Piece DIY Spacer Beads, 1500 Faceted Rondelle Cube Spacer Column Bead, 900 Round Ball Spacer Bead, 600 Square Spacer Bead Charm Loose Be"
Amazon.com,2021-01-01T15:45:38Z,USD,7.36,0.44,0,0,7.8,7.36,0.44,B07ZJ5HL1X,New,1,Closed,Shipped,2021-01-02T16:21:55Z,next-1dc,AMZN_US(TBA120134616004),8mm Nature Stone Beads Gemstone Beads Red Agate Loose Beads for DIY Jewelry Making Approxi 15.5 inch 45pcs 1 Strand per Bag
Amazon.com,2021-01-01T04:28:02Z,USD,6.99,0.42,0,0,7.41,6.99,0.42,B00JF34WT8,New,1,Closed,Shipped,2021-01-08T02:50:50Z,std-us-nft,AMZN_US(TBA126861115304),"BEADNOVA 1mm Elastic Stretch Polyester Crystal String Cord for Jewelry Making Bracelet Beading Thread (12m/ Roll, Total 10 Rolls Mixed Color)"
Amazon.com,2021-01-01T04:17:39Z,USD,6.99,0,0,0,0,Not Available,Not Available,B07VDD8L7R,New,0,Cancelled,Not Available,Not Available,std-us-nft,Not Available,Spacer Bead 300PCS 10 Style Antique Gold Jewelry Bead Charm Spacers Alloy Spacer Beads Kit Jewelry Findings Accessories with 2 Crystal String Bracelet Charm for DIY Bracelet Necklace Jewelry Making
Amazon.com,2021-01-01T04:17:17Z,USD,6.99,0.42,0,0,7.41,6.99,0.42,B07VDD8L7R,New,1,Closed,Shipped,2021-01-02T11:48:58Z,std-us-nft,USPS(9361289675091105618298),Spacer Bead 300PCS 10 Style Antique Gold Jewelry Bead Charm Spacers Alloy Spacer Beads Kit Jewelry Findings Accessories with 2 Crystal String Bracelet Charm for DIY Bracelet Necklace Jewelry Making
Amazon.com,2021-01-01T04:08:44Z,USD,11.99,0.68,0,'-0.6',12.07,21.98,1.28,B08NF8J5W6,New,1,Closed,Shipped,2021-01-04T02:12:19Z,next-1dc,AMZN_US(TBA121490833304),"Varikke for Samsung A71 5G Case, [Fit Magnetic Car Mount] Magnetic Vertical & Horizontal Kickstand Case for Galaxy A71 5G, Slim Anti-Slip TPU Silicone Protective Case for Samsung Galaxy A71 5G, Black"
Amazon.com,2021-01-01T04:08:44Z,USD,9.99,0.6,0,0,10.59,21.98,1.28,B081W17LFY,New,1,Closed,Shipped,2021-01-04T02:12:19Z,next-1dc,AMZN_US(TBA121490833304),"Premium Expanding Phone Socket,Mount Holder for Cellphone Pack 6 (Black)"
Amazon.com,2021-01-01T04:08:44Z,USD,10.99,0.66,0,0,11.65,10.99,0.66,B085Y2P48H,New,1,Closed,Shipped,2021-01-02T23:30:52Z,next-1dc,AMZN_US(TBA119994288604),"GESMA Screen Protector Compatible with Samsung Galaxy A71 4G/5G, [3 Screen Protector+2 Camera Protector+1 Tray] Tempered Glass Compatible with Samsung"
Amazon.com,2021-01-01T00:59:04Z,USD,13.99,0.84,0,0,14.83,13.99,0.84,B07F374NKD,New,1,Closed,Shipped,2021-01-02T11:48:47Z,next-1dc,USPS(9361289675091105618298),"FESHFEN Ponytail Hair Extensions, 15 inch Clip in Ponytail Hairpieces Curly Claw Clip Ponytail Extensions Synthetic Ponytail Clip Long Hair Ponytail H"
Amazon.com,2020-12-30T01:00:36Z,USD,7.97,0.48,0,0,8.45,7.97,0.48,B07QNR8LGW,New,1,Closed,Shipped,2020-12-31T05:20:32Z,next-1dc,AMZN_US(TBA118679764604),"JETech Silicone Case for iPhone SE 2020, iPhone 8 and iPhone 7, 4.7-Inch, Silky-Soft Touch Full-Body Protective Case, Shockproof Cover with Microfiber Lining, Black"
Amazon.com,2020-12-28T02:54:31Z,USD,5.97,0.36,0,0,6.33,5.97,0.36,B01KF0FJX2,New,1,Closed,Shipped,2020-12-28T16:15:17Z,next-1dc,AMZN_US(TBA115361308804),"JETech Case Compatible with iPhone 8, Compatible with iPhone 7, 4.7-Inch, Shockproof Bumper Cover, Anti-Scratch Clear Back, HD Clear"
Amazon.com,2020-12-27T02:36:30Z,USD,7.99,0,0,0,7.99,7.99,0,B08JCXZDC8,New,1,Closed,Shipped,2020-12-28T15:26:26Z,next-1dc,USPS(9374889747009027732291),"Yootech Screen Protector Compatible with iPhone 12 Pro Max,[4 Pack] Tempered Glass Screen Protector Compatible with iPhone 12 Pro Max 2020[Anti-Scratc"
Amazon.com,2020-12-27T02:36:30Z,USD,4.99,0,0,0,4.99,4.99,0,B08M43YBDZ,New,1,Closed,Shipped,2021-01-04T19:34:08Z,next-1dc,UPS(1Z449RX81302920668),360°Shockproof Clear Case for iPhone 12 Pro max Thin Cover Slim Gel Phone Cases Crystal Clear case
Amazon.com,2020-12-22T12:02:20Z,USD,9.8,0.59,0,0,10.39,9.8,0.59,B075HZ3MW3,New,1,Closed,Shipped,2020-12-22T18:37:53Z,next-1dc,USPS(9374889675091008030315),Vimeet Warm Toilet Seat Cover Washable Bathroom Closestool Pad Mat
Amazon.com,2020-12-20T14:13:11Z,USD,28.56,1.71,0,0,30.27,28.56,1.71,B000NICEW6,New,1,Closed,Shipped,2020-12-21T06:55:56Z,next-1dc,AMZN_US(TBA107317029804),"GEARWRENCH 14 Pc. 3/8"" Drive 6 Pt. Standard Socket Set, Metric - 80552"
Amazon.com,2020-12-20T07:18:42Z,USD,5.28,0.32,0,0,5.6,5.28,0.32,B06XDYV5HH,New,1,Closed,Shipped,2020-12-22T19:43:04Z,std-n-us,USPS(9374889675091007665396),"Maybelline Fit Me Matte + Poreless Liquid Foundation Makeup, Soft Sand, 1 fl oz Oil-Free Foundation"
Amazon.com,2020-12-20T02:41:15Z,USD,15.99,0.96,0,0,16.95,15.99,0.96,B081N4QHZ4,New,1,Closed,Shipped,2020-12-20T08:03:27Z,next-1dc,AMZN_US(TBA106531700104),UPKOCH 10pcs Yoghurt Jars Pudding Jar with Lid Yogurt Glass with Plastic Cap Replacement Glass Jars for Jelly Mousse Jam Honey Wedding Baby Shower Fav
Amazon.com,2020-12-19T23:27:25Z,USD,12.98,0.77,0,'-0.65',54.35,51.92,3.08,B081T66NGD,New,4,Closed,Shipped,2020-12-20T08:01:57Z,next-1dc,AMZN_US(TBA152895998801),Ycyan 2Pcs Dual-ended Nail Design Brushes Rhinestone Handle UV Gel Nail Brush Set Professional Nail Art Tools
Amazon.com,2020-12-19T23:27:25Z,USD,6.99,0.42,0,0,7.41,6.99,0.42,B07DFC4YD8,New,1,Closed,Shipped,2020-12-20T08:02:01Z,std-us-nft,AMZN_US(TBA152895998801),"Pana Loxo Silver Color Easy-Off Mandrel Bit 3/32"" Shanks- For Nail Drill/File Made in USA"
Amazon.com,2020-12-16T13:32:28Z,USD,6.99,0.42,0,0,7.41,6.99,0.42,B08FVKZLZY,New,1,Closed,Shipped,2020-12-19T00:57:18Z,next-1dc,UPS(1Z79681F1300013177),"2 Pack 100% Vinyl Clear Raincoat Poncho, Long Sleeves with Snap Closure - Unisex Transparent Rain Jacket Coat, One Size Fits Most - BLUE 2 PK - by Har"
Amazon.com,2020-12-15T02:02:05Z,USD,12.99,0.78,0,0,13.77,12.99,0.78,B08F7LC5X5,New,1,Closed,Shipped,2020-12-15T17:31:38Z,next-1dc,AMZN_US(TBA098929792904),Mud Kingdom Cute Cardigan for Little Boys Button Down Navy Blue Anchor Size 6
Amazon.com,2020-12-15T01:27:46Z,USD,6.99,0.42,0,0,7.41,6.99,0.42,B01DPG75P8,New,1,Closed,Shipped,2020-12-15T08:26:19Z,std-us-nft,USPS(9374889675091003691184),"PANA 3/32"" Shank Size Professional USA - Smooth Top Large Barrel White Ceramic Bit Medium Grit - Nail Drill Bit for Dremel Machine"
Amazon.com,2020-12-15T01:18:46Z,USD,6.99,0.42,0,0,7.41,6.99,0.42,B08MKZ45TN,New,1,Closed,Shipped,2020-12-15T08:26:17Z,std-us-nft,USPS(9374889675091003691184),"Pimoys 7 Pcs Nail Art Painting Pen Brush, Professional Nail Art Brushes UV Gel Nail Brushes for Acrylic Application Professional Salon Quality"
Amazon.com,2020-12-14T18:25:35Z,USD,48.03,2.88,0,0,50.91,48.03,2.88,B004IQHLEA,New,1,Closed,Shipped,2020-12-15T06:55:16Z,next-1dc,AMZN_US(TBA098073362804),"GEARWRENCH 14 Pc. 6 Pt. Combination Wrench Set, Metric - 81925"
Amazon.com,2020-12-14T17:08:32Z,USD,29.99,1.8,0,0,31.79,29.99,1.8,B081Z6GSJ5,New,1,Closed,Shipped,2020-12-15T19:07:48Z,next-1dc,AMZN_US(TBA099039784404),"Audew Cordless Handheld Vacuum, Upgraded Hand Vacuum Cordless Rechargeable Pet Hair Vacuum, Car Vacuum Cleaner for Home and Car Cleaning"
Amazon.com,2020-12-13T17:14:12Z,USD,24.99,0,0,0,24.99,24.99,0,B08HQDL3ZQ,New,1,Closed,Shipped,2020-12-14T10:03:44Z,next-1dc,USPS(9361289747009022112405),"Jogotoll Kitchen Pretend Play Accessories Toys with Stainless Steel Cookware Pots and Pans Set, Cooking Utensils, Apron & Chef Hat and Cutting Play Fo"
Amazon.com,2020-12-11T11:46:09Z,USD,7.99,0.48,0,0,8.47,7.99,0.48,B071DBTVPJ,New,1,Closed,Shipped,2020-12-12T10:38:54Z,next-1dc,AMZN_US(TBA093552841204),Soft Warm Thicken Toilet Seats Covers (Coffee)
Amazon.com,2020-12-10T04:25:21Z,USD,11.99,0.72,0,0,12.71,11.99,0.72,B07TB43KSW,New,1,Closed,Shipped,2020-12-10T10:29:44Z,next-1dc,AMZN_US(TBA152438684801),"Teenitor Fine Glitter, 32 Jars 8g Each Glitter Set, 32 Assorted Color Arts and Craft glitter, Eyeshadow Makeup Nail Art Pigment Glitter, Glitter for s"
Amazon.com,2020-12-09T00:44:27Z,USD,24.99,1.5,0,0,26.49,24.99,1.5,B07CML751L,New,1,Closed,Shipped,2020-12-10T06:38:56Z,std-n-us,USPS(9361289716090452989705),"Rear Liftgate Lift Supports Gas Spring struts Shocks for 2005-2010 Honda Odyssey 6117 SG126007,Pack of 2"
Amazon.com,2020-12-07T04:45:58Z,USD,18.99,1.14,0,0,20.13,18.99,1.14,B083K73NJW,New,1,Closed,Shipped,2020-12-07T09:54:31Z,next-1dc,AMZN_US(TBA085957324304),"YAADUO Car Roller Sunshade, Retractable Car Window Shade for Side-Window - Blocks Harmful Sun Glare and Heat"
Amazon.com,2020-12-07T04:43:21Z,USD,15.99,0.96,0,0,16.95,15.99,0.96,B08KYJ6JK3,New,1,Closed,Shipped,2020-12-09T01:37:53Z,second,UPS(1Z4840V90301430570),ggomaART Car Side Window Sun Shade - Universal Reversible Magnetic Curtain for Baby and Kids with Sun Protection Block Damage from Direct Bright Sunli
Amazon.com,2020-12-03T04:22:18Z,USD,5.76,0.35,0,0,6.11,5.76,0.35,B0046VJ7TE,New,1,Closed,Shipped,2020-12-04T09:15:08Z,next-1dc,AMZN_US(TBA080249749104),"Kank-A Mouth Pain Liquid, Maximum Strength , .33-Ounce"
Amazon.com,2020-12-03T04:18:30Z,USD,5.62,0.34,0,0,5.96,5.62,0.34,B01H1Q8EIA,New,1,Closed,Shipped,2020-12-04T09:15:14Z,next-1dc,AMZN_US(TBA080249749104),"JASON Total Protection Sea Salt Mouth Rinse, Cool Mint, 16 oz. (Packaging May Vary)"
Amazon.com,2020-12-02T05:11:12Z,USD,12.99,0.78,0,0,13.77,12.99,0.78,B076LJTH6X,New,1,Closed,Shipped,2020-12-03T03:59:20Z,next-1dc,USPS(9374889675090996713729),"Govc Girls Winter Warm Fleece Lined Elastic Waist Velvet Stretchy Thick Leggings(Black Cat,M)"
Amazon.com,2020-12-02T05:09:56Z,USD,9.99,0.6,0,0,10.59,9.99,0.6,B08K4GZG1P,New,1,Closed,Shipped,2020-12-03T10:16:50Z,next-1dc,AMZN_US(TBA079660308204),Beloved Lucia Kids Girls Leggings Warm Fleece Lined Pants Thick Trousers for Winter Navy 12-13
Amazon.com,2020-12-02T01:48:26Z,USD,12.98,0,0,0,12.98,12.98,0,B081T66NGD,New,1,Closed,Shipped,2020-12-02T22:00:07Z,next-1dc,USPS(9374889747009016763954),Ycyan 2Pcs Dual-ended Nail Design Brushes Rhinestone Handle UV Gel Nail Brush Set Professional Nail Art Tools
Amazon.com,2020-12-02T01:47:17Z,USD,12.98,0.78,0,0,13.76,22.97,1.38,B081T66NGD,New,1,Closed,Shipped,2020-12-02T22:57:01Z,next-1dc,USPS(9374889675090996614781),Ycyan 2Pcs Dual-ended Nail Design Brushes Rhinestone Handle UV Gel Nail Brush Set Professional Nail Art Tools
Amazon.com,2020-12-02T01:47:17Z,USD,9.99,0.6,0,0,10.59,22.97,1.38,B089K64M4S,New,1,Closed,Shipped,2020-12-02T22:57:01Z,next-1dc,USPS(9374889675090996614781),Havenport 3 Pack Dual-ended Nail Brush Pen Nail Art Brush Nail Painting Brushes Nail Art Liner Brush UV Gel Nail Brush Set Nylon Hair with Rhinestone 
Amazon.com,2020-12-02T01:47:17Z,USD,6.66,0.4,0,0,7.06,6.66,0.4,B0854C7QTZ,New,1,Closed,Shipped,2020-12-02T18:22:37Z,std-us-nft,UPS(1Z7A8Y800353999311),DSDecor Resin Nail Art Palette Nail Painting Makeup Palette Tray Cosmetic Nail Gel Polish Colors Mixing Pallet (Blue)
Amazon.com,2020-12-02T01:47:17Z,USD,8.43,0.51,0,0,8.94,8.43,0.51,B088NG464L,New,1,Closed,Shipped,2020-12-02T15:59:59Z,next-1dc,USPS(9374889675090996485411),10 Style Mesh Nail Sticker DIY Gold Silver 3D Net Line Tape on Nails Adhesive Silk Foil Nail Art Decorations Polish Decals
Amazon.com,2020-12-01T12:08:32Z,USD,14.99,0.9,0,0,15.89,14.99,0.9,B07M824HXQ,New,1,Closed,Shipped,2020-12-02T10:50:20Z,next-1dc,USPS(9374889675090996463341),"Kids Gloves, Magic Stretch Gloves 8 Pairs, Children Anti-Slip Full Fingers Knitted Winter Glove for Boys and Girls"
Amazon.com,2020-11-29T03:55:13Z,USD,23.99,1.44,0,0,25.43,23.99,1.44,B08F3NN5BG,New,1,Closed,Shipped,2020-11-30T20:18:43Z,next-1dc,AMZN_US(TBA075718412304),ccko Hooded Robes for Women Plush Lightweight Cute Warm Soft Shawl Collar Bathrobe for Women S-3XL
Amazon.com,2020-11-26T03:38:12Z,USD,10.99,0.66,0,0,11.65,10.99,0.66,B07DC5PPFV,New,1,Closed,Shipped,2020-11-26T16:02:38Z,next-1dc,USPS(9374889716090446061055),"USB C Cable, Anker [2-Pack, 6 ft] Type C Charger Premium Nylon USB Cable , USB A to Type C Charging Cable Fast Charge for Samsung Galaxy S10 S10+ / No"
Amazon.com,2020-11-25T20:53:05Z,USD,10.99,0.66,0,0,11.65,10.99,0.66,B07DC5PPFV,New,1,Closed,Shipped,2020-11-27T05:13:09Z,next-1dc,AMZN_US(TBA071215511404),"USB C Cable, Anker [2-Pack, 6 ft] Type C Charger Premium Nylon USB Cable , USB A to Type C Charging Cable Fast Charge for Samsung Galaxy S10 S10+ / No"
Amazon.com,2020-11-25T05:17:36Z,USD,10.99,0.63,0,'-0.55',11.07,10.99,0.63,B07DC5PPFV,New,1,Closed,Shipped,2020-11-25T16:47:11Z,next-1dc,AMZN_US(TBA070370947004),"USB C Cable, Anker [2-Pack, 6 ft] Type C Charger Premium Nylon USB Cable , USB A to Type C Charging Cable Fast Charge for Samsung Galaxy S10 S10+ / Note 8, LG V20 and Other USB C Charger (Black)"
Amazon.com,2020-11-23T13:03:43Z,USD,8.45,0.17,0,0,8.62,8.45,0.17,B01F9LPRDY,New,1,Closed,Shipped,2020-11-24T07:27:57Z,next-1dc,AMZN_US(TBA068929199604),Russell Stover Dark Chocolate Coconut Mini Gusset Bag 6 Ounce Russell Stover Chocolate Coconut Chocolate Candy Bag; Sweet Coconut Covered in Rich Choc
Amazon.com,2020-11-23T04:25:05Z,USD,8.99,0.54,0,0,9.53,8.99,0.54,B07T24N38T,New,1,Closed,Shipped,2020-11-25T14:49:18Z,next-1dc,AMZN_US(TBA068047191004),"Boy Flamingo Short Sleeve Button Down Shirt & Pink Shorts Pants Kids Summer Outfits 1-6 T Clothes Set (Green&Yellow, 5-6T)"
Amazon.com,2020-11-23T04:23:59Z,USD,13.99,0.84,0,0,14.83,13.99,0.84,B07WHR66DB,New,1,Closed,Shipped,2020-11-23T10:31:50Z,next-1dc,AMZN_US(TBA067725196204),"Toddler Baby Boy Flamingo Short Sleeve Button Down Shirt & Casual Shorts Set Summer Outfits 1-6 Years Clothes (Green&Red, 5-6T)"
Amazon.com,2020-11-23T04:17:07Z,USD,9.99,0.6,0,0,10.59,9.99,0.6,B08LDMGGGL,New,1,Closed,Shipped,2020-11-23T17:50:12Z,next-1dc,AMZN_US(TBA068112953604),"Summerjokes Family Funny Inspirational Wall Stickers""Family.is Where Our Story Begins"" Wallpaper Art Stickers, Family Living Room Kitchen Bathroom Bed"
Amazon.com,2020-11-23T04:14:56Z,USD,9.99,0.6,0,0,10.59,9.99,0.6,B08LV2XKRX,New,1,Closed,Shipped,2020-11-24T17:49:46Z,std-n-us,USPS(9374889675090992568644),"LASZOLA DIY Mirror Butterfly Wall Sticker Love Laugh Live Quotes Wall Decal, 3D Butterflies Heart Home Nursery Decor Art Murals Paper Decoration for L"
Amazon.com,2020-11-22T14:50:58Z,USD,14.99,0.9,0,0,15.89,14.99,0.9,B07DJD9B6B,New,1,Closed,Shipped,2020-11-22T20:48:22Z,next-1dc,AMZN_US(TBA067013064704),"Immuson Fanfold 4 x 6 Direct Thermal Shipping Labels with Perforations, 500 Labels, Permanent Adhesive, White Mailing Labels for Thermal Printer"
Amazon.com,2020-11-22T14:50:58Z,USD,139.99,7.8,0,'-10',137.79,139.99,7.8,B08D7J1S34,New,1,Closed,Shipped,2020-11-23T05:53:58Z,next-1dc,AMZN_US(TBA067519575504),"Comer Shipping Label Printer - Commercial Grade Direct Thermal High Speed Printer for Barcodes,Labels,Mailing,Shipping and More-150mm/s-4x6 Printer"
Amazon.com,2020-11-21T22:53:34Z,USD,22.92,1.38,0,0,24.3,47.67,2.87,B0813ZZHVW,New,1,Closed,Shipped,2020-11-22T06:51:32Z,next-1dc,AMZN_US(TBA151546310101),"Houseables Thank You Merchandise Bags, Retail Shopping Goodie Bag, Plastic, 16"" x 18"", 100 Pk, Low Density, 1.75 Mil Thick, Glossy, Gold and White Color, with Handles, for Stores, Boutiques, Clothes"
Amazon.com,2020-11-21T22:53:34Z,USD,24.75,1.49,0,0,26.24,47.67,2.87,B07V5CJ7TG,New,1,Closed,Shipped,2020-11-22T06:51:32Z,next-1dc,AMZN_US(TBA151546310101),"Spartan Industrial - 6"" X 9"" (1000 Count) Crystal Clear Resealable Polypropylene Poly Bags for Jewelry, Cards, Photos, Envelopes - Self Seal & Reinforced"
Amazon.com,2020-11-21T08:07:24Z,USD,27.99,1.65,0,'-0.56',29.08,27.99,1.65,B08NSKL1CL,New,1,Closed,Shipped,2020-11-23T07:10:36Z,Std US D2D Dom,YunExpress(YT2032821266158296),"Icefei 2020 Newest Kids Drawing Projector Table, Art Tracing Projector Painting Toy, Learn to Draw Sketcher Desk, Fun Educational Learning Drawing Boa"
Amazon.com,2020-11-21T02:55:03Z,USD,5.99,0.36,0,0,6.35,5.99,0.36,B0774BRJWN,New,1,Closed,Shipped,2020-11-21T11:27:37Z,next-1dc,USPS(9361289675091080296429),"BigOtters Toilet Seat Cover Pads, Washable Toilet Seat Cushion Mat Winter Washable Toilet Seat Warmer (Gray)"
Amazon.com,2020-11-21T02:41:47Z,USD,5.99,0.36,0,0,6.35,5.99,0.36,B08CBZY8FX,New,1,Closed,Shipped,2020-11-21T16:24:29Z,std-us-nft,USPS(9361289675091080350909),"UOONY 2 Boxes Dried Flowers for Nail Art, 24 Colors 3D Mini Real Natural Flowers Nail Art Supplies with Tweezers for Tips Manicure Decor"
Amazon.com,2020-11-21T02:41:47Z,USD,5.99,0.36,0,0,6.35,5.99,0.36,B082HDZMZP,New,1,Closed,Shipped,2020-11-22T06:51:42Z,next-1dc,AMZN_US(TBA151546310101),Valuu 10 Sheets Nail Art Foil Transfer Stickers Flower Plant Maple Leaves Nail Foil Adhesive Decals Starry Sky Manicure Transfer Tips Nail Art DIY Decoration Kit
Amazon.com,2020-11-21T02:41:47Z,USD,14.59,0.88,0,0,15.47,107.69,6.47,B01LSKCDWI,New,1,Closed,Shipped,2020-11-21T16:24:27Z,next-1dc,USPS(9361289675091080350909),NICOLE DIARY 4 Boxes Dry Flower Nail Art DIY Preserved Flower Decorations With Heart-Shaped Box Nail Art Decoration
Amazon.com,2020-11-21T02:41:47Z,USD,14.55,0.87,0,0,15.42,107.69,6.47,B08CZX5857,New,1,Closed,Shipped,2020-11-21T16:24:27Z,next-1dc,USPS(9361289675091080350909),"Christmas Decorations - 30 PCS Christmas Holiday Classic Variety Kraft Gift Bags Bulk with Christmas Prints - Good for Christmas Goody Bags,Xmas Party"
Amazon.com,2020-11-21T02:41:47Z,USD,7.99,0.48,0,0,8.47,107.69,6.47,B07ZV6ZKQ9,New,1,Closed,Shipped,2020-11-21T16:24:27Z,next-1dc,USPS(9361289675091080350909),Makartt Nail Art Foil Transfer Stickers Nail Art Supplies Foil Transfers 10 Rolls Rose Flowers Nail Decals Nail Extension Gel Art Decorations for Wome
Amazon.com,2020-11-21T02:41:47Z,USD,19.99,1.2,0,0,63.57,107.69,6.47,B08HC8VDK7,New,3,Closed,Shipped,2020-11-21T16:24:27Z,next-1dc,USPS(9361289675091080350909),"48 Christmas Kraft Goody Gift Paper Bags with Handles Assorted Christmas Characters for Xmas Party Favors, Holidays Giving Goodie Bags"
Amazon.com,2020-11-21T02:41:47Z,USD,10.59,0.64,0,0,11.23,107.69,6.47,B08JLY5H8W,New,1,Closed,Shipped,2020-11-21T16:24:27Z,next-1dc,USPS(9361289675091080350909),100 Pieces Christmas Plastic Bags Christmas Party Favor Bags Snowman Elk Santa Christmas Tree Treat Bags Candy Bags Goody Bags Christmas Trick or Trea
Amazon.com,2020-11-20T23:18:16Z,USD,59.99,4.8,0,0,64.79,59.99,4.8,B07V2QFXHH,New,1,Closed,Shipped,2020-11-22T18:13:14Z,next-1dc,UPS(1Z0918WV0378159177),Ubauba All-Season Queen Down Comforter 100% Cotton Quilted Feather Comforter with Corner Tabs. Lightweight Goose Down Duvet Insert Grey Cotton Comfort
Amazon.com,2020-11-19T03:19:14Z,USD,21.99,1.32,0,0,23.31,39.98,2.4,B0863GHQVL,New,1,Closed,Shipped,2020-11-19T17:09:41Z,next-1dc,AMZN_US(TBA151446481801),Merchandise Bags 9x12 - Snowflakes Blue - 100 Pack - Glossy Retail Bags - Holiday Shopping Bags for Boutique - Boutique Bags - Plastic Shopping Bags (
Amazon.com,2020-11-19T03:19:14Z,USD,17.99,1.08,0,0,19.07,39.98,2.4,B01LLSNG1E,New,1,Closed,Shipped,2020-11-19T17:09:41Z,next-1dc,AMZN_US(TBA151446481801),"Twinkle Star 300 LED Window Curtain String Light Wedding Party Home Garden Bedroom Outdoor Indoor Wall Decorations, Warm White"
Amazon.com,2020-11-19T03:06:49Z,USD,32.99,1.98,0,0,34.97,32.99,1.98,B07XC1VV86,New,1,Closed,Shipped,2020-11-19T09:19:49Z,next-1dc,AMZN_US(TBA063045222704),"Humidifiers for Babies, TaoTronics 3-IN-1 Humidifier with Essential Oil Diffuser and Night Light, 2.5L Cool Mist Humidifier for Bedroom, BPA-Free, 26dB Whisper Quiet, Easy to Clean"
Amazon.com,2020-11-18T03:35:02Z,USD,9.99,0.6,0,0,10.59,9.99,0.6,B0856246YY,New,1,Closed,Shipped,2020-11-18T18:34:01Z,next-1dc,UPS(1Z9YF2031317444219),"ATack Extra Sticky Clear Double-Sided Tape, Removable, 2-Inch x 20-Yards - Wall Safe Heavy-Duty Double Sides Self Sticky Wall Fabric Tape for Wood Templates, Furniture, Leather, Curtains and Craft"
Amazon.com,2020-11-18T03:32:43Z,USD,8.91,0.53,0,0,9.44,8.91,0.53,B0816Q5D5Z,New,1,Closed,Shipped,2020-11-18T18:34:06Z,next-1dc,UPS(1Z9YF2031317444219),"Symoden 15.7"" x 118"" Matte White Wallpaper White Peel and Stick Wallpaper Self-Adhesive Removable Wallpaper Thicken Waterproof Wallpaper for Kitchen Countertop Cabinet Wardrobe"
Amazon.com,2020-11-17T03:48:05Z,USD,10.99,0.66,0,0,11.65,10.99,0.66,B075TWL4XS,New,1,Closed,Shipped,2020-11-17T19:20:58Z,next-1dc,UPS(1Z806YR41303667438),U-BCOO Sink Spray Rubber Hose Portable Shampoo Sprayer (Hose)
Amazon.com,2020-11-17T03:38:17Z,USD,3.87,0.23,0,0,4.1,3.87,0.23,B00172M6Y8,New,1,Closed,Shipped,2020-11-17T23:35:15Z,std-us-nft,UPS(1Z093A7A0362164887),Graham Beauty Salon Truewave Jumbo End Paper 1000 Pack - HC-26067
Amazon.com,2020-11-17T03:38:00Z,USD,8.99,0.54,0,0,9.53,8.99,0.54,B004S44DTS,New,1,Closed,Shipped,2020-11-19T05:13:05Z,second,USPS(9374889675090990246018),"Ogilvie Salon Styles Professional Perm for Color Treated, Thin or Delicated Hair"
Amazon.com,2020-11-17T03:34:58Z,USD,14.99,0.81,0,'-1.5',14.3,14.99,0.81,B08B1PHGY6,New,1,Closed,Shipped,2020-11-17T18:19:07Z,next-1dc,UPS(1Z9YF2031317417936),Hair Perm Rods Set 80 Pieces 4 Sizes Jumbo Large Medium Small Plastic Cold Wave Perming Rods Curlers for Straight Curly Natural Hair Hairdressing Styling Hair Rellers Tool (Orange Yellow Purple White)
Amazon.com,2020-11-17T03:27:31Z,USD,8.09,0,0,0,0,Not Available,Not Available,B0895T3LVV,New,0,Cancelled,Not Available,Not Available,next-1dc,Not Available,"Beomeen Hair Perms Paper, Salon Perm End Papers Hair Curling Tissue Paper Hairdressing Styling Tool for Hair Perming Hair Perm Rods Pads"
Amazon.com,2020-11-17T01:37:06Z,USD,10.9,0.65,0,0,11.55,10.9,0.65,B081W17LFY,New,1,Closed,Shipped,2020-11-17T18:58:08Z,next-1dc,AMZN_US(TBA061086145804),"Premium Expanding Phone Socket,Mount Holder for Cellphone Pack 6 (White)"
Amazon.com,2020-11-16T21:14:12Z,USD,2.13,0.12,0,'-0.11',2.14,2.13,0.12,B005JRB9TU,New,1,Closed,Shipped,2020-11-17T19:20:49Z,next-1dc,UPS(1Z806YR41303667438),"Opti-Free Puremoist Multi-Purpose Disinfecting Solution with Lens Case, 2-Ounces (Packaging may vary)"
Amazon.com,2020-11-16T20:13:11Z,USD,12.99,0.78,0,0,13.77,12.99,0.78,B07NYT7TQW,New,1,Closed,Shipped,2020-11-21T07:49:12Z,second,USPS(9361289675091080004055),"Cubeware 25-Pack Snap-Seal, Microwavable, Dishwasher and Freezer Safe, Reusable Food Storage Bento Box, Meal Prep Containers (28 oz, BPA Free)"
Amazon.com,2020-11-16T20:06:58Z,USD,6.98,0.42,0,0,7.4,6.98,0.42,B0751MM6TK,New,1,Closed,Shipped,2020-11-17T18:58:13Z,std-us-nft,AMZN_US(TBA061086145804),"GOLDEN APPLE, 2-Ounce Clear Plastic Jello Shot Souffle Cups with Lids, Sampling Cup (100 Sets), BPA Free"
Amazon.com,2020-11-16T20:06:15Z,USD,10.99,0.66,0,0,11.65,10.99,0.66,B07NT6S2JH,New,1,Closed,Shipped,2020-11-17T19:20:54Z,next-1dc,UPS(1Z806YR41303667438),"Safeware 16oz [24 Sets] Deli Plastic Food Storage Containers with Airtight Lids - Great for Slime, Soup Containers, Portion Control and Meal Prep | Mi"
Amazon.com,2020-11-16T19:26:58Z,USD,12.92,0.78,0,0,13.7,12.92,0.78,B00JTNBZZI,New,1,Closed,Shipped,2020-11-19T13:01:18Z,next-1dc,AMZN_US(TBA061443308904),"Astro 136E-4356 3/8-Inch Anvil O-Ring and Retaining Ring, 10-Piece"
Amazon.com,2020-11-16T13:42:09Z,USD,9.98,0.6,0,0,10.58,9.98,0.6,B08FRNS5T1,New,1,Closed,Shipped,2020-11-17T18:19:02Z,next-1dc,UPS(1Z9YF2031317417936),"3D Soccer Ball Football Decorative Peel Vinyl Wall Stickers Wall Decals, DIY Removable Stick Baby Boys Girls Kids Room Nursery Wall Mural Decor 5"
Amazon.com,2020-11-16T03:03:34Z,USD,47.96,2.88,0,0,50.84,47.96,2.88,B074NHT1SM,New,1,Closed,Shipped,2020-11-16T20:55:39Z,next-1dc,UPS(1Z0W37F00383852017),"Furinno 5-Tier Reversible Color Open Shelf Bookcase , White"
Amazon.com,2020-11-15T19:48:40Z,USD,4.99,0.3,0,0,5.29,17.57,1.06,B08HV9M837,New,1,Closed,Shipped,2020-11-16T10:13:42Z,next-1dc,AMZN_US(TBA151293498201),12 Box Different Shape Holographic Glitter Flakes Bulk Nail Sequins DIY Decoration for Body Face Eye Makeup Festival Accessories (red)
Amazon.com,2020-11-15T19:48:40Z,USD,6.99,0.42,0,0,7.41,17.57,1.06,B08J8FZFRD,New,1,Closed,Shipped,2020-11-16T10:13:42Z,next-1dc,AMZN_US(TBA151293498201),Snowflake Glitter Nail Sequins - 12 Grids 3D Colorful Christmas Holographic Nail Flakes Glitter Confetti Sticker Decals Manicure Nail Design Makeup DIY Decoration
Amazon.com,2020-11-15T19:48:40Z,USD,5.59,0.34,0,0,5.93,17.57,1.06,B08JLVX5YX,New,1,Closed,Shipped,2020-11-16T10:13:42Z,next-1dc,AMZN_US(TBA151293498201),12 Colors Maple Leaf Nail Sequins 3D Holographic Fall Leaves Nail Art Glitter Sequins Autumn Fall Nail Flakes with Tweezers for Women Manicure Nail Decoration Supplies
Amazon.com,2020-11-15T19:48:40Z,USD,7.59,0.46,0,0,8.05,7.59,0.46,B08J46QGH8,New,1,Closed,Shipped,2020-11-16T22:45:06Z,next-1dc,USPS(9374889675090989497902),"12 Colors Maple leaf star opposite sex Nail art sequins,3D thin flakes metallic maple leaf star shaped colorful stickers manicure supplies Christmas n"
Amazon.com,2020-11-15T03:26:47Z,USD,3.99,0.24,0,0,4.23,3.99,0.24,B07PLBV634,New,1,Closed,Shipped,2020-11-16T10:17:13Z,std-us-nft,USPS(9374889675090989376986),"TailaiMei Color Removal Cleaner Sponge, Quickly & Easily Clean Makeup Brushes Without Water or Chemical Solutions Eliminating Drying Time - Switch Eyeshadow Colored Immediately"
Amazon.com,2020-11-14T00:34:57Z,USD,9.99,0.6,0,0,10.59,9.99,0.6,B0834NLHHQ,New,1,Closed,Shipped,2020-11-15T00:42:13Z,next-1dc,USPS(9374889675090988598129),Lucoss Shimmer Eye Shadow Glitter Liquid Long Lasting Effect Waterproof Shiny Liquid Eye Shadow Pen Eye Makeup
Amazon.com,2020-11-13T18:48:40Z,USD,10.19,0.61,4.77,0,15.57,10.19,0.61,B07RLVHKC8,New,1,Closed,Shipped,2020-11-14T23:34:16Z,Std US D2D Dom,USPS(9400111202555233871425),"Baby Boy Flamingo Tops T-Shirt+Pink Shorts Pants Toddler Kids Outfits Summer Clothes Set (Blue&Pink, 4-5T)"
Amazon.com,2020-11-13T16:23:56Z,USD,149.95,8.55,0,'-7.5',151,149.95,8.55,B08CQJ366S,New,1,Closed,Shipped,2020-11-15T18:27:43Z,second-nominated-day,AMZN_US(TBA058994472304),"ACDelco G12 Series 12V Li-ion Cordless ¼"" & 3/8"" Rachet Wrench Combo Tool Kits (2 Batteries Tool Kit)"
